IsSpam,Text
0,prc committee meeting april you have been selected serve the performance review committee this selection based your performance and recognizing that you possess the behaviors are trying underline encourage and reward through our prc process serving the committee like underscore the important role you will play not only with respect the prc but also setting the standards and guidance for prc across enron the prc the foundation which our talent managed and rewarded therefore critical that you give your full attention prepare appropriately and serve champions for the process from overall enron perspective meeting the prc committee scheduled for april the enron building floor boardroom discuss mid year prc tele conference video conference will provided where appropriate agenda for the meeting attached for your review and information please contact gina corteselli jackie martin confirm your participation regards dave
0, extension petro canada wholesale gas services arrangementfor more yearsafter great deal work the canadian team has renewed our outsourcing arrangement with petrocanada for another years this was great accomplishment for enron canada the logistics accounting and commercial execution over the last and years played key role extending this deal john original message from milnthorp robsent tuesday march amto lavorato johnsubject extension petro canada wholesale gas services arrangement for more yearsjohn per our telecon please see the attached for details let know you require something further forwarded rob milnthorp cal ect from eric ledain amto rob milnthorp cal ect ectcc subject extension petro canada wholesale gas services arrangement for more yearson wednesday the president petro canada approved the extension our wholesale gas services agreement after the first term expires november for incremental years this has taken while get closed and while doing have had keep consistently high level service but keep mind not easy renew something half way through the first term this extension very significant for the following reasons creates mtm income cdn net directly attributable costs provide the back office services supports further deal flow and potential incentive arrangement income along with all the production information etc even greater importance provides very critical and frequently used marketing tool continue build our gas and power businesses across canada you know have used the petro canada arrangement example the services can provide not only when marketing canada but also the and europe now can tell potential customers that not only have provided services this customer for years but they liked much they already extended the agreement for five more years after the first term the message has that are providing good quality service obviously this great credit our commercial staff and the operations accounting and staff that work with petro canada will separately advise each the individuals who works this account about the renewal and congratulate them takes alot effort enchant the customer day after day year after year fact incredibly difficult effectively trial day and day out service provider the numbers under the extension have provided petro canada with rebate applied the remaining term the agreement from our original base fee original base fee cdn per year payable monthly rebate offered jan nov cdnnov nov cdnfee charged for extension term nov nov cdnnov nov cdnnov nov cdnnov nov cdnnov nov cdnwe have thoroughly defined our back office costs required provide these services cdn and have years operating history support this projection with escalation per year for the second five year term these costs include back office staff allocations salaries and benefits and rent infrastructure allocation have checked the allocation houston costs and per transaction basis these are insignificant compared our base business transaction levels not include commercial staff costs the above they are covered the incentive arrangement and ongoing transaction deal flow discussions with wes this definition the costs and certainty about the arrangement scope will allow mtm this income the mtm income cdn includes the rebate offered for the last two years the current term and has been reduced the above annual costs notes have not defined the incentive fee for the second five year period yet are doing some work the moment with pcog what our benchmark should given that much the intermediate producers the group have disappeared will revise the agreement reflect the fact that there will further revision once the incentive fee agreed petro canada sales volumes fall last years levels there will price reopener for the remaining term because have defined the fee absolute cost rather than per unit rate also have reopener price the volumes grow about today levels petro canada has growth strategy for gas this not all expected volumes over the last months have increased about year year peter and should have the amended agreement out next week 
0,proposed changes business practices based the californiaenergy crisisover the past several months have reviewed detail our trading contracts and the companies through which conduct our trading business california order reduce enron non market risks legal credit and regulatory the volatile commodity markets california any future california propose the following changes mandatory uniform set off provisions all trading contracts for all commodities set off language varies commodity commodity trading contracts set off one the most critical tools available enron major default situation and critical have set off language and have uniform commodity commodity that enron can get the best advantage from set off and not just the least common denominator master netting agreements for appropriate counterparties with multiple masters with significant opposite exposures where necessary have multiple masters with counterparty bridge should put place between the masters whenever there significant opposite exposures under the two more masters merge epmi into ena power trades are done through epmi merging epmi into ena and conducting power trades through ena much more efficient from both credit and legal point view automatic termination for bankruptcy event the pge sce situation should the non defaulting party enron this case option terminate rather than automatic termination inability pay debts they become due let know you have any other proposed changes our trading contracts entities through which conduct our trading believe these changes will improve efficiency reduce risks iii develop the opportunity more business with certain counterparties and substantially improve enron position the next california type market the long range goal conduct much possible the trading business through single entity and single limited number standardized agreements 
0, planelouise fyi one would hope that statistically speaking the clear for while best regards max forwarded max yzaguirre enron andy zipper enron enronxgate max yzaguirre enron enron subject planemax would find doubtful that that the flight crew would test the aircraft such fashion during scheduled flight with pax aboard anytime there problem with flight control that very serious glad they seemed have handled the situation probably was not vor problem but more likely flight control problem control surfaces rudder ailerons the vor fail message could have been due power down the avionics consistent with post emergency landing procedure have commercial pilot certificate and have done some charter work addition flown the simulator united and know how many back ups those things have they are very redundant really glad everything turned out okay all the best andy original message from yzaguirre maxsent wednesday march pmto zipper andysubject planeandy was actually the person whom this happened was aeromexico flight yesterday from mexico city monterrey within minutes after leaving mexico city the plane started hump and down and then started fishtailing unclear whether this was something the pilot was doing test the plane not quickly circled back mexico city but came very very low our approach and seemed losing speed any event was exiting the plane looked into the cockpit and saw the message vor fail the center display being admitted greenhorn these things didn know what else look for where look for there may have been something overlooked the crew was very short details but they appeared very rattled all this one the flight attendants told fellow passenger who was complaining about being late that should simply thankful was still alive probably not what they teach flight attendant school the optimal response but any event appreciate the info below and would appreciate any additional info this message may lead you love know whether not the adrenaline surge was warranted best regards maxlouise kitchen ect max yzaguirre subject plane forwarded louise kitchen hou ect from andy zipper enron enronxgate amto louise kitchen hou ect ectcc david forster corp enron enronsubject planea vor the standard instrument for navigating aircraft under ifr flight plan the receiver that allows the plane flown bearings from ground stations were fail there would loads backups although you are scheduled flight their operations manual would dictate that the flight terminated soon practicable the event any primary component such this were fail where were you that you were able monitor the performance this instrument the flight deck original message from kitchen louisesent wednesday march amto zipper andy forster davidsubject planeif shows vor failure any idea what that was 
0, buzzwordsalso please search for the name dwayne hart 
0,buzzwordsas promised from our meeting earlier today business names firms projects acreage relevant numbersupstream products mrha aker devil tower production offshore byargeon convergent crazy horse double lease structure fowler aep triton fasb sell down haynes pioneer idc tax benefits sullivan marinercorridor herasimchuk dominiontieback spartech pfpsofloating production facilityspar spari think this list exhaustive please include the phone numbers given brian redmond from our meeting earlier you have any further questions please contact brian redmond will leaving for calgary this evening and returning friday morning will checking voicemail and mobile regards jean
0, corporate culture committeei love committees and this sounds like real cracker see you there can strongly recommend parenthood you good luck with yours coming soon think also congrats the new big role great news rlouise kitchen richard lewis lon ect ectcc subject corporate culture committeehello how are you see both got landed with this having been before the appropriate word definitely landed with this hope you are enjoying fatherhood and that earnings pressure isn getting you that end quarter feeling again see speak you the conference call louise forwarded louise kitchen hou ect from vanessa bob enron pmto danny mccarty enron enron gene humphrey enron enronxgate gregory adams corp enron enron janet dietrich hou ees ees jean mrha enron enron jeff donahue enron communications enron communications jeffrey shankman enron enronxgate louise kitchen hou ect ect mark palmer corp enron enron michael kopper hou ect ect michael terraso ots enron enron mitchell taylor enron enronxgate paula rieker corp enron enron richard lewis lon ect ect robert jones enron enronxgate sean long enron development enron development shelley corman enron enronxgate jordan mintz enron enronxgate tim orourke enron enronxgatecc gregory adams corp enron enron ruth mann enron enronxgate kay chapman hou ees ees joyce dorsey enron communications enron communications bert frazier enron enronxgate lisa costello enron enronxgate tammie schoppe hou ect ect inez dauterive hou ect ect felicia legier enron development enron development julie armstrong corp enron enron melissa jones enron enron cindy derecskey corp enron enron laura valencia corp enron enron jennifer burns enron enronxgate rosario boling enron enronxgate laura glenn ots enron enron richard lewis lon ect ect stacy walker enron communications enron communications darlene forsyth enron enronxgate elisa tamez enron enronxgate ruth ann brown hou ees ees kathy mcmahon enron enron cindy olson corp enron enronsubject corporate culture committeeculture committee members are delighted that you are available attend the first meeting enron new corporate culture committee this meeting will held monday april from the executive directors this committee cindy olson beth tilney and kelly kimberly are hoping that all members will able attend this very important kickoff meeting you have any questions require additional information please contact thanks vanessa
0,fyi skilling talks about the multiple 
0,selden has asked for copy all our don want give them anything more than line bio you have anything prepared spoke with koenig and chatting with palmer tomorrow koenig said try and make but also thinks palmer should involved because the fortune angle will fill you later tomorrow 
0,expert finderhttps expertfinder enron com 
0, hot list louise please find attached below the ercot hotlist for the week april thanks chris ahn original message from curry mikesent monday april amto ahn chrissubject hot list please forward hotlist soon possible thanks mike original message from rode tinasent friday april amto baughman edward brown michael curry mike pagan ozziecc duran davidsubject hot list please provide hot list project list louise soon possible thanks tina forwarded tina rode hou ect louise kitchen amto tina rode hou ect ectcc tammie schoppe enron comsubject hot list yes but still looking for something similar for the rest the groups baughman pagan east power and south east power tina rode amto tammie schoppe hou ect ect louise kitchen hou ect ectcc subject hot list attached the hot list that you requested let know you would like receive this weekly thanks tina
0,minutes prc committee meeting aprilattached are the minutes the prc committee meeting april gina corteselliglobal performance management
0, second draft organisation annoucementlouise what you think about asset marketing group like donlouise kitchen pmto don miller hou ect ectcc subject second draft organisation annoucementi happy wait for stuart monday don miller amto louise kitchen hou ect ectcc subject second draft organisation annoucementlouise spun things around bit but honestly comfortable with either version should this detmering well are pleased announce the creation new group business development within enron americas the business development group will have responsibility for the divestment function within enron americas and work with generation investments selected portfolio acquisitions well managing power origination funding requirements with treasury don miller will head the business development group and will report directly the office the chair enron americas please join congratulating don his new role louise kitchen pmto louise kitchen hou ect ectcc david duran hou ect ect don miller hou ect ectsubject second draft organisation annoucementlouise kitchen pmto david duran hou ect ect don miller hou ect ectcc subject first draft organisation annoucementstraw man announcement please pad out are pleased announce don miller will joining enron americas with the responsibility for heading new group within the organisation the business development group will have responsibility for the divestment function within enron americas and work with the generation investments group selected portfolio acquisitions well managing power origination funding requirements with treasury don will report directly the office the chair enron americas joining don commercial director this group will stuart sizman who has most recently been working with don the divestment our five peaking plants please join congratulating don and stuart their new roles 
0,stuart zismanlouise stuart officially coming over have meeting set with oxley discuss his and contract understand you want meet with will there don
0,capital bookto further the process reaching the stated objectives increasing enron america velocity capital and associated return invested capital have decided create capital book the capital book will have profit target associated with and will managed joe deffner the purpose creating this book ensure that all transactions within enron americas with any form capital requirement are structured correctly and are allocated the appropriate cost capital charge the previous numbers used the business plans the beginning this year will remain for all transactions place and where hold assets therefore any assets currently held within each business area the capital charge will remain internal ownership these assets will maintained the originating business unit subject the internal ownership policy outlined below the cost capital associated with all transactions enron americas will set joe this process separate and apart from the current rac process for transactions which will continue unchanged capital investments balance sheet will continue accrue capital charge the previously established rate transactions which are structured off credit will receive pure market pass through the actually incurred cost capital opposed the previous across the board charge transactions which are structured off balance sheet but credit will priced based upon the financial impact enron america overall credit capacity transactions that deploy capital through the trading books the capital book will take finance reserve each transaction similar the way the credit group takes credit reserve this finance reserve will used specifically fund the capital required for the transaction noted above the capital book will have budget and will essentially charge out the origination and trading groups actual cost sending market based capital pricing signals internally enron america sources capital and liquidity should better optimized across the organization questions regarding the capital book can addressed joe deffner alan quaintance 
0,hsr updateanne and talked with neil imus our however the three concurred that timing more important than the method communication and that meeting cannot arranged the next day two should ahead and present our request over the phone with letter follow perhaps attempted reconnect with aep lawyers but were unsuccessful will continue try press aep for decision how proceed please call anne you have any questions will keep you posted 
0,the power who expertfinderthe enron corporate policy committee introduces expertfinder expertfinder allows you locate people within the enron community organization structure skills reporting relationships languages school attended and prior work experience expertfinder secured application that available upon completion your certificate compliance expertfinder can accessed the enron intranet typing the following url the internet explorer command line and log using the hrgis provided below https hrglobal enron comyour hrgis your password date birth format yyyymmdd current users the global launch zone will maintain the same password you don remember your password click forgot password below the log button should you have any questions regarding access data issues expertfinder contact the hrgim line global information management expertfinder only good the data provided does your personal data need updating ehronline enron com home enron hrol caller htm enron europe limited only update your data today contact your generalist for business unit related updates 
0, transferring into the programmy one year anniversary enron june lst this time will able apply for transfer into the analyst program hope back school the near future and feel that the analyst program along with enron experience the best road take would very much appreciated you would help this process writing letter recommendation each you has been influential both enron whole and myself could not think anyone better represent this way you could have this the first week may that would great you need anything from this regard please let know thank you adriane original message from gordon altheasent friday april pmto schultea adrianecc warner tracisubject transferring into the programthank you for your interest transferring into the program order transfer you must have least one year enron experience along with your resume would need three recommendation letters one from level higher one from current previous supervisor and the other your discretion and copy your recent prc you must have rating strong higher your prc eligible the best course action this point start collecting all this information for your transfer application packet prior your one year anniversary you can submit this information about month from your anniversary date having delivered you have any questions please not hesitate contact thanks bunch althea
0,visitlouise know you are very busy but discuss with you person how you think going with gtv and few other things keep short say minutes some this week early next week out friday generally and out that helps with your schedule regardssteve
0,ena projects meetingthe above mentioned meeting has been scheduled for wednesday april from you have any questions please call thanks 
0, gtv weekly status updatelouise attached plan for the roll out windows for the trading groups for which tibco has been scripted richard burchfield and are currently investigating the state tibco the windows plaftorm that still being used and will get back you when have determined the tibco solution can incorprated into script before the actual roll out win regardssteve original message from kitchen louisesent tuesday april amto wei zhiyongcc storey geoff bibi philippe perlman beth stock stephen sullivan colleensubject gtv weekly status updatewho responsible for the upgrade and have plan place implement this from zhiyong wei enron enronxgate pmto louise kitchen hou ect ect geoff storey hou ect ect philippe bibi enron enronxgate beth perlman enron enronxgate stephen stock enron enronxgate colleen sullivan hou ect ectcc subject gtv weekly status updateplease find below the gtv project status update for this week please see the attached file for the project timeline update microsoft project gtv status meeting attendees zhiyong wei karima husain francis lim jeremy wong bill fortney nayan dattani dave nommensen russ severson narasim kasaru mike swaim george grant chuck ames geof storey accomplishments incorporating physical deal positions tds changes cpr reader process and its unit testing have been completed changes for the view aggregation and its unit testing have been completed new task has been added due the requirement loading prior day curves into position manager please see the attached project timeline changes for position manager are progress please see the attached project timeline single point deal entry for term deals single point deal entry now ready for user acceptance testing gas daily deals changes erms portcalc application for the gas daily deals are complete and ready for testing changes tds deal valuation are progress and schedule please see the attached project timeline new task has been added flag fixed price positions please see the attached project timeline live feeds for gas daily intra month curves released productionplans for the week ending continue development phase items obtain sign off for gtv phase issues and timeline commence development phase issues issues incompatibility tibco version and the single point deal entry done using tibco some users are still using tibco upgrading either tibco windows needed thankszhiyong
0, cresendolouise meeting with scott josey thursday regarding crescendo going propose him that all crescendo goes into ecr and reimburses upstream products for incurred capital charges for since ecr utilizing nick cocavessis technical services organization for all infrastructure needs and reports brian redmond upstream products would not charging ecr fee the technical services organization commercial support for enron americas have spoken brian and fine with proposal addition josey and have had brief conversation and thursday expect negotiating details regards jean original message from kitchen louisesent tuesday april amto mrha jeansubject cresendobearing mind this split how about put all ecr and then you charge them fee for all work you thoughts 
0,ene detailed earnings analysis following conf call reiterat ratingene detailed earnings analysis following conf call reiterate rating ene reported eps last year above our andconsensus estimates and respectively raised our est based confidence continuedstrong growth wholesale segment well incremental contribution fromretail energy company raised guidance highlights merchant energy wholesale volumes ahead our expectation driven growing need for intermediation services andcontinuing impact enrononline segment ibit with higher unitmargins reflecting volatility running twice last year level ourcalculation expect full year volatility match level bandwidth trading deals are getting done above expectations transactions lqol and for full year results include reserve for receivables owed from pcg incalif raymond nilespower natural gas researchsalomon smith barney ray niles ssmb coms ene lqol detailed doc ene lqol detailed pdf
