IsSpam,Text
0, cinergy closing press releaselouise fine with you can see from jennifer email both ena and corp approved withheld from the market until skilling was finished with his analyst meeting donlouise kitchen pmto don miller hou ect ectcc subject cinergy closing press releaseare you with this forwarded louise kitchen hou ect jennifer walker enron pmto mark frevert enron greg whalley hou ect ect john lavorato corp enron louise kitchen hou ect ectcc eric thode corp enron enronsubject cinergy closing press releaseattached the press release announcing the completion cinergy acquisition enron brownsville and caledonia generating facilities basically just reiteration the press release issued december announcing the acquisition the release has been approved enron corp and and will issued this afternoon please call with any questions thanks jennifer walkerena public relations 
0,gtv weekly status updatelouise the gtv team has weekly status meeting mondays yesterday had our first status meeting please see below for the current status the project please see the attached file for the update project timeline microsoft project gtv status meeting attendees zhiyong wei karima husain francis lim jeremy wong bill fortney nayan dattani mike swaim dave nommensen russ severson george grant accomplishments incorporating physcial deal positions tds changes cpr reader process have been completed changes for the view aggregation are done changes for the position manager are progress and are about completed single point deal entry for term deals establishing communication between tds client sitara server progress gas daily deals changes tds deal valuation are progress creating gdi calc erms progress live feeds for gas daily intra month curves development live feeds progress goef has been contacted regarding how use the features plans for the week ending continue the development gtv phase commence the work gtv phase inception document issues none regardszhiyong
0, ngplfyi zipper andy original message from gomez juliesent tuesday march amto zipper andysubject ngpli have called deb the president again pipelines move one speed slow soon hear back will let you guys know julie from andy zipper enron enronxgate amto julie gomez hou ect ectcc david forster corp enron enronsubject ngpljulie didn get finish our conversation the elevator ngpl expect them repsond they think the price too high then can start negotiating they think any price too high then have problem given that you have relationship with the person charge there getting response from them will really help figure out whether this going fly not thanks 
0,corporate culture committeeculture committee members are delighted that you are available attend the first meeting enron new corporate culture committee this meeting will held monday april from the executive directors this committee cindy olson beth tilney and kelly kimberly are hoping that all members will able attend this very important kickoff meeting you have any questions require additional information please contact thanks vanessa
0, driftlouise let clarify point obviously mangled previous email are going change gary drift allocation amounts north america talked mike about this yesterday and agrees the current allocation aggressive need talk gary thursday about these changes and nothing else give him heads that are going this the costs allocated you related drift will definitely reduced and will have the revised numbers for you thursday regards brent original message from kitchen louisesent tuesday march pmto price brent mcconnell mikesubject driftclearly this incorrect allocation gary allocating north america for people for just managing drift has now taken two months get nowhere this issue revert back mike for resolution this louisefrom brent price enron enronxgate pmto louise kitchen hou ect ectcc subject driftlouise current status drift expense allocations have reviewed the million question and that amount correct given the methodology being used gary allocate costs when gary back the office thursday will through his allocations with him determine need change that methodology and thus change the allocation percentages will let you know the outcome that meeting also keep mind that the million represents plan amount actuals should much less since are currently well under plan headcount amounts and not all plan expenses have been made let know you have any questions will keep you updated regards brent original message from kitchen louisesent wednesday march pmto price brent killen faithcc mcconnell mikesubject driftbrent mike and have discussed the drift plan and clearly there was allocation issue somewhere along the line please let have our new numbers thankslouise
0, driftlouise current status drift expense allocations have reviewed the million question and that amount correct given the methodology being used gary allocate costs when gary back the office thursday will through his allocations with him determine need change that methodology and thus change the allocation percentages will let you know the outcome that meeting also keep mind that the million represents plan amount actuals should much less since are currently well under plan headcount amounts and not all plan expenses have been made let know you have any questions will keep you updated regards brent original message from kitchen louisesent wednesday march pmto price brent killen faithcc mcconnell mikesubject driftbrent mike and have discussed the drift plan and clearly there was allocation issue somewhere along the line please let have our new numbers thankslouise
0, astro baseball season ticketssection row seats original message from kitchen louisesent tuesday march amto hillis kimberlysubject astro baseball season ticketswhere are they from john lavorato enron enronxgate enronxgate amsent kimberly hillis enron enronxgateto phillip allen hou ect ect david duran hou ect ect joseph deffner enron enronxgate brian redmond hou ect ect colleen sullivan hou ect ect mike grigsby hou ect ect mike swerzbin hou ect ect john arnold hou ect ect kevin presto hou ect ect hunter shively hou ect ect fletcher sturm hou ect ect rogers herndon hou ect ect barry tycholiz enron enron dana davis enron enronxgate fred lagrasta hou ect ect thomas martin hou ect ect scott neal hou ect ect edward baughman enron enronxgate harry arora enron enronxgate don miller hou ect ect ozzie pagan enron enronxgate michael miller enron enron richard lydecker corp enron enron jim schwieger hou ect ect carl tricoli corp enron enron frank vickers enron enron mark whitt enron enron mcmichael hou ect ect jesse neyman hou ect ect greg blair corp enron enron douglas clifford ect ect michael miller enron communications enron communications allan keel enron enronxgate scott josey enron enronxgate bruce sukaly enron enronxgate julie gomez hou ect ect jean mrha enron enron john thompson enron enronxgate steve pruett enron enronxgate gil muhl corp enron enron michelle parks enron enronxgate brad alford enron enron robert greer hou ect ectcc louise kitchen hou ect ect tammie schoppe hou ect ectsubject astro baseball season ticketsthe astro season about kick off and enron americas office the chairman has four tickets each game available for customer events you are interested using the tickets please call kim hillis 
0, draft dash dwrlouise this draft very preliminary have not received any input from the market risk group regulatory have passed for comments david port and jim steffes initial view risk adjusted capital for market risk that will zero based the offsetting position currently the book will have more information the morning can discuss further tomorrow thanks bill original message from ngo tracysent tuesday march pmto kitchen louisecc bradford william subject draft dash dwrlouise per the request bill bradford attached please find initial draft the dash for the dwr put option please note that are waiting final legal risk memorandum well comments from jim steffes for the regulatory risks please let know you have any questions initial comments regards tracy
0,draft dash dwrlouise per the request bill bradford attached please find initial draft the dash for the dwr put option please note that are waiting final legal risk memorandum well comments from jim steffes for the regulatory risks please let know you have any questions initial comments regards tracy
0,california update item the puc draft decision which implements the cent kwh rate increase has just passed unanimously commissioner lynch stressed again that this rate increase can only used the utilities for power purchases going forward with the only exception being that the utilities must pay the state the money they owe for the power purchased the dwr the tiered rate structure was not debated voted upon lynch said that this cannot decided until the rate structure complete and the committee would work this issue expedited basis approximately days commissioners brown and wood explicitly thanked lynch for taking courageous leadership spearheading this decision 
0,caiso list market abusersattached list parties the cal iso has identified earlier report that had overcharged the market from may nov the filing was mistakenly put into the ferc docket room ees listed party with excessive rents the biggest overcharger was powerex with are still analyzing the implications this list and will get out any other information jim forwarded james steffes enron nancy pickover subject caiso supplemental filingattached fax received filing the iso made yesterday afternoon supplement its comments docket elo regarding market monitoring and mitigation the filing links the names the suppliers and importers discussed sheffrin analysis the code numbers used yesterday filing the iso had requested confidential treatment the fax tiff format and you can disregard the first page cover sheet please let know you have any questions need anything else nancydate tue mar from faxto subject fax from pages mime version content type multipart mixed boundary aaol time pmreceived from remote inbound user pickn routing code result successful sendpage record elapsed time channel tif
0,california update executive summary undercollet remains sticking point for utility creditors especially qfs involuntary bankruptcy likely issue not addressed today capuc hearings capuc rate increase set pending dwr power purchase details davis defends rate increase position distances himself from capucqf generator undercollect may invitation involuntary bankruptcyas reported last week has sitting and waiting hear what the capuc has say unfortunately may not what the qfs want hear the utilities undercollect which will not addressed today capuc hearings could very well provide invitation for qfs and generators file involuntary bankruptcy against socal and recent rate hikes proposed the capuc specifically dictate that any revenue generated from rate increases cannot used pay off utility past debt leaving the with little hope recovery qfs were obviously dismayed the capuc draft order and the decision passed currently reads involuntary bankruptcy filing still likely capuc holds rate increase hearings todayas reported yesterday loretta lynch released the details the capuc draft rate increase order last night there expected cent kwh surcharge power bills roughly rate increase portion this surcharge will given the dwr cover its costs and the order concludes that utilities need revenues going forward basis therefore utilities can only use the revenues for power purchases going forward and are expressly forbidden from using this cash pay down past debt qfs however the utilities are ordered resume payments the qfs going forward basis the net effect the order allow the utilities operate case bankruptcy one interesting point the draft its decision which calls the utilities join with the state pursuing refund the amount overcharged for power the generators the suggestion that the utilities take legal action against the generators recoup funds only the funds recovered from generators can used pay down the utilities past debt the utilities choose this course action would very lengthy process davis contends with lynch capuc rate increases davis has thus far refused support capuc proposed rate increase stating the capuc decision making board independent body and that continues believe that resolution can found within the current rate structure sources indicate that likely ask for lynch letter resignation however there indication she will comply senator burton who supports the capuc plan reportedly will protect lynch not allowing her impeached which the only other way she could removed the governor 
0, westinghouse alouise our proposal for ena assume the nominal cost the turbine jan exclusive carrying costs that date from jan forward will assume full responsibility for any carrying costs and any continuing payment obligations under the purchase contract with westinghouse the nominal cost the turbine jan exclusive carrying costs this the amount that propose ena assume with respect the turbine the carrying cost through jan assumed calme part this proposal this amount reflects the actual carrying charges imposed enron corp calme based upon the payments made westinghouse under the purchase agreement the continuing payment obligation assumed ena under the purchase contract with westinghouse this amount reflects the actual final payment due under the contract which due commercial operations please let know you need anything else resolve this you have any questions regards benlouise kitchen pmto ben jacoby hou ect ectcc subject europe turbinescan you send quick email summary what want the calme trasfer and deal with thankslouiseenron capital trade resources corp from ben jacoby pmsent ben jacobyto louise kitchen hou ect ectcc subject europe turbinesok the way did you have discussion with calme the carrying costs the westinghouse regards benlouise kitchen amto ben jacoby hou ect ectcc subject europe turbineseel now selling its fas previously mentioned for arcos referred john sherriff you see you have any potential outlets for these turbines case someone telephones you that where the call comes from louise
0, deacero salouise are working value the cost both coverages can compare the reduction credit reserve any should have first look over with markus tomorrow regards drew original message from fiala markussent tuesday march amto kitchen louise william bradford hou ect enroncc seyfried bryan tingleaf drewsubject deacero salouise some news and views for yourself this credit hedging this name for any duration past years all but impossible present insurance companies will write protection with first loss being taken ene but proof loss must exist and all covents must adhered otherwise payout can made void believe the offering you have from zurich should used cover first mil mil exposure the front end this the cheapest alternative but does come with certain hindrances timeliness payments and proof loss additional constraint here the better private rating ene must get for deacero what enroncredit can offer hedge the excess exposure above the insurance coverage would cover failure pay and bankruptcy said name would offer protection either year rolling tranche format protection can either bought for the duration yrs npv cash settlement louise you get paid out recovery financial assets payout rolling basis bpts over where enroncreit hedges itself the market expect get protection off per annum present have the ability structure this tranche accreting amortising basis either suit the actual exposures payment can made digital cost would stated cost expected recovery louise you want call today discuss will till london time bill would hedge out the credit exposure ltol basis and run the duration risk require permission from yourself run manage this risk mkf
0, projects summaryno these are credit total return swaps finance guy characterise off balance sheet credit off footnote disclosure chucklouise kitchen ect pmto charles ward corp enron enroncc subject projects summarywhen you say off the balance sheet non recourse charles ward enron amto louise kitchen hou ect ectcc david duran hou ect ect garrick hill hou ect ect mike mazowita corp enron enron chip schneider enronsubject projects summaryall projects are owned trs foe structure total return swap friend enron result our continued ownership portland general the two current east project companies are motown and cornhusker motown consists two interests and has trs about million and the balance sheet for about million michigan power power plant fully contracted for power years and remaining years fixed cost gas the ppa deep the money versus cost generate even after the swapped gas dynegy operates and managing general partner mgp and operator fair performance record both best michigan currently entering into stranded cost filings and the time near propose restructuring have waited for about months doug clifford the origination the purchase had been attempting purchase dynegy interest they have too high book value and are accrual based the proposed restructuring will take the form upfront payment return for option provide power from the market this approach gives consumer bbb credit much needed cash time when they are significantly underrecovering due increased fuel costs and set fuel recovery rates consumer like many other utilities has hard time seeing their exposure purchased power cost certainty for the volume and term and doesn see any regulatory filing complications with their current stranded cost filings the amended ppa non unit contingent power short which fill long term with contract from the power desk the desk takes the obligation because generation investments provides full backstop pricing through their ownership the plant and the swapped gas either float past the swapped gas contract for differences those years with the gas desk the ppa and desk contract are securitized the capital markets for the term the ppa dscr and about bps over consumer current corporate bonds the plant essentially becomes npv machine and the power desk has significant optionality call from the market rather than the plant for years during the term the swapped gas when the plant isn called the desk can sell the gas into the market for profit fairly easy see the increased value the project currently project financed about dscr for about years lots cash the desk has significant optionality and always matched cost supply with the plant the plant gains efficiency due revised insurance reserves etc which are longer required due the removal project financing difficulties dynegy and consumers consumers can rational dynegy either must sell play along current operational project management issues which dynegy caused may make their interest available ada plant fully contracted for power years enron the mgp operates for owned coned fixed gas through would propose restructuring the same time michigan power this would leave consumers with only one unrestructured ppa currently revisiting buying comed interest cornhusker trs about and about balance sheet interest single plant texas small coop which very litigious plant has had some rather spectacular failures have pictures which make the engineers our floor shudder which would glad pass along but the ppa only requires availability before significantly the money capacity payments are reduced essentially impossible reach loss the failures have been related westinghouse carl tricoli spent the first months upto february trying sell the project the coop spent last month determining that the coop will never buy the project they just don have the and are very expensive lender taking last stab restructuring proposal the coming month and upon appraisal the coop intentions potentially enter the sell mode paso has indicated interest the project already the citizen employee over there attempted restructure some time ago sell the closing should again apologize for the delay getting you this info call with questions chuck
0, projects summaryall projects are owned trs foe structure total return swap friend enron result our continued ownership portland general the two current east project companies are motown and cornhusker motown consists two interests and has trs about million and the balance sheet for about million michigan power power plant fully contracted for power years and remaining years fixed cost gas the ppa deep the money versus cost generate even after the swapped gas dynegy operates and managing general partner mgp and operator fair performance record both best michigan currently entering into stranded cost filings and the time near propose restructuring have waited for about months doug clifford the origination the purchase had been attempting purchase dynegy interest they have too high book value and are accrual based the proposed restructuring will take the form upfront payment return for option provide power from the market this approach gives consumer bbb credit much needed cash time when they are significantly underrecovering due increased fuel costs and set fuel recovery rates consumer like many other utilities has hard time seeing their exposure purchased power cost certainty for the volume and term and doesn see any regulatory filing complications with their current stranded cost filings the amended ppa non unit contingent power short which fill long term with contract from the power desk the desk takes the obligation because generation investments provides full backstop pricing through their ownership the plant and the swapped gas either float past the swapped gas contract for differences those years with the gas desk the ppa and desk contract are securitized the capital markets for the term the ppa dscr and about bps over consumer current corporate bonds the plant essentially becomes npv machine and the power desk has significant optionality call from the market rather than the plant for years during the term the swapped gas when the plant isn called the desk can sell the gas into the market for profit fairly easy see the increased value the project currently project financed about dscr for about years lots cash the desk has significant optionality and always matched cost supply with the plant the plant gains efficiency due revised insurance reserves etc which are longer required due the removal project financing difficulties dynegy and consumers consumers can rational dynegy either must sell play along current operational project management issues which dynegy caused may make their interest available ada plant fully contracted for power years enron the mgp operates for owned coned fixed gas through would propose restructuring the same time michigan power this would leave consumers with only one unrestructured ppa currently revisiting buying comed interest cornhusker trs about and about balance sheet interest single plant texas small coop which very litigious plant has had some rather spectacular failures have pictures which make the engineers our floor shudder which would glad pass along but the ppa only requires availability before significantly the money capacity payments are reduced essentially impossible reach loss the failures have been related westinghouse carl tricoli spent the first months upto february trying sell the project the coop spent last month determining that the coop will never buy the project they just don have the and are very expensive lender taking last stab restructuring proposal the coming month and upon appraisal the coop intentions potentially enter the sell mode paso has indicated interest the project already the citizen employee over there attempted restructure some time ago sell the closing should again apologize for the delay getting you this info call with questions chuck
0,deacero salouise some news and views for yourself this credit hedging this name for any duration past years all but impossible present insurance companies will write protection with first loss being taken ene but proof loss must exist and all covents must adhered otherwise payout can made void believe the offering you have from zurich should used cover first mil mil exposure the front end this the cheapest alternative but does come with certain hindrances timeliness payments and proof loss additional constraint here the better private rating ene must get for deacero what enroncredit can offer hedge the excess exposure above the insurance coverage would cover failure pay and bankruptcy said name would offer protection either year rolling tranche format protection can either bought for the duration yrs npv cash settlement louise you get paid out recovery financial assets payout rolling basis bpts over where enroncreit hedges itself the market expect get protection off per annum present have the ability structure this tranche accreting amortising basis either suit the actual exposures payment can made digital cost would stated cost expected recovery louise you want call today discuss will till london time bill would hedge out the credit exposure ltol basis and run the duration risk require permission from yourself run manage this risk mkf
